{
  "id": "8a9b0c1d-2e3f-4a5b-8c9d-0e1f2a3b4c5d",
  "type": "drt.assigned",
  "source": "citizen-api",
  "time": "2025-01-15T17:46:10Z",
  "data": {
    "request_id": "f7a8b9c0-1d2e-4f3a-4b5c-7d8e9f0a1b2c",
    "user_sub": "citizen",
    "vehicle_id": "8a2c4e6f-1b3d-4a5c-8e9f-0a1b2c3d4e5f",
    "driver_sub": "driver-7",
    "assigned_at": "2025-01-15T17:46:09Z"
  }
}
